<?xml version="1.0" encoding="UTF-8"?>
<!DOCTYPE metadata-config PUBLIC "-//persist4j/Metadata 0.3" "https://raw.githubusercontent.com/devezhao/persist4j/master/src/main/resources/metadata.dtd">
<metadata-config schema-name-optimize="true" default-parent="SystemCommon">

	<entity name="SystemCommon" type-code="000">
		<field name="commonReference" type="reference" ref-entity="TestAllType" description="引用"/>
	</entity>

	<entity name="TestAllType" type-code="100">
		<field name="tPrimary" type="primary" description="主键" />
		<field name="tReference" type="reference" ref-entity="TestAllType" description="引用"/>
		<field name="tInt" type="int"/>
		<field name="tSmallInt" type="small-int"/>
		<field name="tDouble" type="double" decimal-scale="6"/>
		<field name="tDecimal" type="decimal" decimal-scale="7" />
		<field name="tLong" type="long" auto-value="true"/>
		<field name="tDate" type="date" description="日期"/>
		<field name="tTimestamp" type="timestamp" description="日期时间" />
		<field name="tTime" type="time" description="时间" />
		<field name="tChar" type="char" description="字符"/>
		<field name="tString" type="string" description="文版"/>
		<field name="tText" type="text" description="长文本"/>
		<field name="tBool" type="bool" description="布尔"/>
		<field name="tNtext" type="ntext" description="超大文本"/>
		<field name="tBinary" type="binary" description="二进制数据"/>
		<field name="tAnyReference" type="any-reference" ref-entity="*" description="任意引用"/>
		<field name="tAnyReference2" type="any-reference" ref-entity="Test2,Test3" description="任意引用"/>
		<field name="tReferenceList" type="reference-list" ref-entity="TestAllType" description="多引用"/>
		<index type="fulltext" field-list="tText,tNtext" />
		<index field-list="tReference" />
		<index field-list="tAnyReference" type="unique" />
	</entity>
	
	<entity name="Test2" type-code="102">
		<field name="t2Primary" type="primary" description="主键" />
		<field name="t2Reference" type="reference" ref-entity="TestAllType" description="引用"/>
		<field name="t2Int" type="int"/>
	</entity>
	
	<entity name="Test3" type-code="103">
		<field name="t3Primary" type="primary" description="主键" />
		<field name="t1Reference" type="reference" ref-entity="TestAllType" description="引用"/>
		<field name="t2Reference" type="reference" ref-entity="Test2" description="引用"/>
		<field name="sum" type="double"/>
		<field name="count" type="double"/>
	</entity>
	
	<entity name="Test4" type-code="104">
		<field name="t4Primary" type="primary" />
		<field name="year" type="string"/>
		<field name="quarter" type="string" />
		<field name="month" type="string"/>
		<field name="week" type="string" />
		<field name="count" type="string"/>
	</entity>

	<entity name="MainEntity" type-code="200">
		<field name="id" type="primary"/>
		<field name="name" type="string"/>
	</entity>

	<entity name="DetailEntity1" type-code="201" main="MainEntity">
		<field name="id" type="primary"/>
		<field name="name" type="string"/>
	</entity>

	<entity name="DetailEntity2" type-code="202" main="MainEntity">
		<field name="id" type="primary"/>
		<field name="name" type="string"/>
	</entity>
	
</metadata-config>